Question ID,Contributor aka Name,In Progress / Finished,Avg Result,Question,Class, Answer
1619,,,10,Software engineering: How do you go about estimating the time required to complete a project.,COS340,
1628,,,10,What is the basic idea of programmable shaders as compared to the standard OpenGL pipeline?,COS350,
1631,AC/DK,X,10,What is compositing of images? Why is it useful in animation?,COS425,Compositing is like the post production when you make it look pretty. For example&#44; you could add fog&#44; color balance&#44; etc. It's useful in animation because it allows you to layer images and create effects that you can't do while you animate. It can also be useful for reducing the amount of time to create certain effects.
1642,,X,10,"Explain the concept of event handlers including the ""windows"" programming model.",COS265,Event handlers 
1655,AK,X,10,"What is meant by ""functional language""? Example.",COS382,In computer science&#44; functional programming is a programming paradigm that treats computation as the evaluation of mathematical functions and avoids state and mutable data. It emphasizes the application of functions&#44; in contrast to the imperative programming style&#44; which emphasizes changes in state.[1] Functional programming has its roots in lambda calculus&#44; a formal system developed in the 1930s to investigate function definition&#44; function application&#44; and recursion. Many functional programming languages can be viewed as elaborations on the lambda calculus.[1] Javascript is an example of a functional language. prominent functional programming languages such as Common Lisp&#44; Scheme&#44;[2][3][4][5] ISLISP&#44; JavaScript&#44; Clojure&#44; Racket&#44;[6] Erlang&#44;[7][8][9] OCaml&#44;[10][11] Haskell&#44;[12][13] Scala[14] and F#[15][16] 
1657,,,10,How does a stack overrun attack work?,COS284,
1661,SRW,X,10,If an algorithm is O(n^3) and requires 10 units of time for some data&#44; what happens if we double the amount of data to process?,COS265,It will take 1000 units of time
1666,,,10,Draw vectors involved in diffuse reflection and explain rile of angles.,COS351,
1705,,,10,What is the basic approach to numeral integration?,MAT151,
1707,NJC,X,10,What is a stack?,COS121,A stack is a last in&#44; first out (LIFO) abstract data type and linear data structure. Also known for  two fundamental operation called pop and push.
1709,,,10,Which of Crosby's four absolutes apply to software testing? How/why?,SYS390,
1710,,,10,OR - linear programming?,SYS401,
1719,,,10,Explain complexity classes P&#44; NP&#44; NP complete.,COS 320,
1724,SRW,X,10,CV - What is the basic approach to edge detection?,Computer Vision,Use a filter to determine the rate of change in intensity of pixels. The areas with higher values will generally be where edges are.
1725,,,10,What is a finite state transducer? Give an example of how it is used in NLP.,COS265,
1726,,,10,What does it mean to say that an algorithm is O(lg N)? Example?,COS265,
1727,,,10,Contrast Breadth First Search and Depth First Search. (BFS and DFS),COS265,
1728,,X,10,Pick a book from HRO and tell the main point from it.,IAS330,No.
1729,,,10,Describe the appropriate experimental methodology for evaluating the performance of an NLP system against a particular data set.,N/A,
1731,,,10,Describe basic idea of a NN,N/A,
1733,,X,10,What is the difference between diffuse surfaces and specular surfaces?,COS350,Diffuse surfaces do not reflect as much light; they are matte. Specular surfaces have highlights and reflect more light.
1734,AAC,X,10,What is the affordance of an object? How does this relate to software design?,SYS 214,Affordance is a quality of an object which allows some action to be performed. In Software design this means that people come to a program expecting that certain actions will be there and they want the software design to reflect that these actions can be accomplished. 
1736,AAC,X,10,What is the difference between vector graphics and raster graphics?,COS350,Vectors are created via mathematical equations and raster graphics are based on pixels. This is why there is such a quality differences between when images are enlarged or shrunk between vector graphics and raster graphics.
1738,NJC,X,10,What technical advantages are there to having HTML and CSS separated? What organizational ones?,COS143/COS264,The technical advantages are the site uses less bandwidth and loads faster&#44; the site will get better search results&#44;... The organization advantages are the content is separated from the design&#44;...
824,DKK,X,10,Gulf of execution vs. evaluation,SYS214,The gulf of execution is the gap between a users desired goal and the means to achieve that goal given by a system. The gulf of evaluation is the gap between the result of an action and the users ability to interpret the result of that action. (or the amount of difficulty the user has in determining the state of a system) 
825,DKK,X,10,computer vision - image enhancement ,COS351,know it.
,DKK,X,,what is one technique?,,image sharpening such as Laplacian filter. Adjust contrast using histogram equalization (stretch out the histogram using cumulative distribution). Apply noise reduction or median filter. 
,DKK,X,,why do it?,,Image enhancement can make it easier for a computer to recognize patterns and make decisions based on those patterns. Also to make images pretty!
498,,X,10,What is the difference between conceptual and logical database design?,COS341,http://www.1keydata.com/datawarehousing/data-modeling-levels.html
70,,,10,What is an expert system shell?,SYS352,
830,,,10,dezcribe inverse kinematics,COS425,
117,,X,10,What is an Entity Relationship Diagram (ERD)? [follow on] Draw one that representsthe relationship between students and classes.,SYS390,ERD's illustrate the logical structure of a database. A data modeling technique used in software engineering to produce a conceptual data model of a information system. A box with student and a box with classes with a one to many relationship. 
608,,,10,Convert the following binary number to octal and hexadecimal: 10111101,COS381,
843,,,10,Draw a Venn diagram that illustrates union&#44; intersection&#44; and difference.,Discrete?,
844,,,10,What are the main ideas of keyframe animation?,COS425,
550,,,10,Discuss texture mapping. What is it? Why is it desirable?,COS350,
851,,,10,What is a B2B application?,SYS394,
853,AK,X,10,What is an ERD?,SYS390,Entity Relationship Diagram is a diagram of a database design
854,,X,10,What is the complexity of your favorite sort algorithm?,COS265,Bubble sort FTW!
30,,,10,What is a Gantt chart? Draw one with 4 tasks. [follow on] Explain how would you useit?,SYS200,
862,,,10,What is accessibility?,SYS214,
863,NJC,X,10,What are some ways to ensure data integrity in a data base?,SYS101,Data encryption&#44; Data backup&#44; Access controls&#44; Input validation&#44; and Data validation
865,,,10,DFS - data structure,N/A,
405,,,10,Graphs are useful in representing maps&#44; pipelines&#44; networks&#44; and routes. How can theybe represented in a computer? [follow on] Create the adjacency matrix for: A ----- B ---- C,COS320,
879,,,10,Discuss the architecture of a basic stamp compared to a msp430&#44; espicially the memory.,N/A,
886,,,10,Use the MSP430 Timer a block diagram to explain how the timer operates.,N/A,
892,,,10,Define Settling time&#44; rise time and percent overshoot. Draw a graph if that helps.,N/A,
918,,,10,Make a simple sketch of a field effect transistor and describe how it works.,N/A,
924,,,10,Define the laplace transform and describe how to use a laplace transform.,COS351,
479,,,10,White and black box testing are two methods of increasing software quality. Describethem.,COS340,
230,,,10,In the past&#44; what language was most dominant in the development of business applicationssoftware? What are the currently most dominant? Why the change?,COS240,
945,,,10,how are binary trees ordered - always?,COS121,
989,AS,X,10,What are Crosby's four absolutes?,SYS101,1. The definition of quality is conformance to requirements 2. The system of quality is prevention 3. The standard of quality is zero defects 4. The measure of quality is the price of nonconformance
1028,,X,10,What is a greedy algorithm? Give an example.,COS265,An algorithm that uses the technique of taking the optimal choice at every point with the hope being that it leads to the best overall outcome.
254,,,10,What is the difference between prefix&#44; infix and postfix notation? Give examples.,COS250,
957,,,10,What decimal value does the twos complement value 0101 represent? What about 1111?,COS284,
246,,,10,When writing functions it is helpful to write preconditions and postconditions. Whatare they and why would you include them?,COS250,
1032,MCW,X,10,What is a functional programming language? Give an example language.,COS120,A functional programming language is: 1. a programming language that focuses on functions&#44; rather than state changes&#44; as a means of evaluating expressions&#44; and it can be cross-platformed.
977,,,10,What is a page table used for?,COS284,
959,,,10,What is the binary representation of 4.75?,COS284,
1033,BN,X,10,Describe hashing. Why is it used? Problems?,COS265,A hash is a way of storing data that allows for constant time (O(1)) searching of data.  Collisions are problems
1034,,,10,What is meant by a partially ordered data structure? Example.,COS265,
1036,,,10,Why do you normalize a database? Why might you want to not normalize?,N/A,
1042,,,10,Describe some important considerations when connecting transmission lines.,N/A,
1043,,,10,Compare OSI and IP stacks.,N/A,
269,,,10,When two different data values are sent through a hashing function it is possible that the same index may be generated. This results in a collision. What are someways that collisions can be resolved?,COS250,
1106,,,10,what is the critical path in project management?,SYS394,
1240,,,10,DFA&#44; NFA what is the difference? Is one more powerful than another?,N/A,
1245,,,10,What is the basic process involved in Kepner-Tregoe decision analysis (DA)?,SYS394,
1338,AK,X,10,When mapping from an Entity-Relationship Diagram (ERD) to an RDBMS&#44; what do entities become in the RDBMS? Attributes?,SYS390,Entities in an ERD turn into tables in an RDBMS and attributes turn into table columns
1341,,,10,In project scheduling&#44; what is the purpose of calculating the critical path?,N/A,
1442,SRW,X,10,Difference between DFA/NFA - power?,COS435,Just as powerful as each other (can both be used to represent the same languages). DFA is more efficient when implemented&#44; NFA is often easier to work with when trying to define a language.
1454,,,10,What does a parser do?,N/A,
1479,AK,X,10,Crosby's Four Absolutes,SYS101,1. The definition of quality is conformance to requirements 2. The system of quality is prevention 3. The standard of quality is zero defects 4. The measure of quality is the price of nonconformance
1517,SRW,X,10,Give an example of a regular expression. Why are they useful?,N/A,"""http\:s?\/\/www\.\w+\.com"" These can be very useful when searching for substrings or matching inputs that can take a variety of forms"
1520,,,10,What is a DFA and an NFA? How are they different?,N/A,
1521,,,10,What is an abstract data type?,N/A,
1562,,,10,What are some characteristics of a greedy algorithm?,N/A,
404,,,9.8,,COS320,
262,MCW,X,9.75,What is the difference between static memory allocation and dynamic memory allocation?,COS250,Static memory allocation is storing data on a segment of memory by the compiler before run-time; whereas&#44; dynamic allocation stores data on heap and is assigned by functions during run-time.
1627,AK,X,9.67,What are Crosby's 4 absolutes?,SYS101,1. The definition of quality is conformance to requirements 2. The system of quality is prevention 3. The standard of quality is zero defects 4. The measure of quality is the price of nonconformance
1679,,,9.67,Describe the memory hierarchy.,N/A,
1681,,,9.67,What is the role of SCM?,N/A,
1699,SRW,X,9.67,Which of Crosby's four absolutes of quality is most relevant to software testing?,N/A,The System of Quality is Prevention
1700,,,9.67,What are the key principles of the Scrum agile development methodology?,SYS394,
1712,,,9.67,Describe the purpose and basic form of a KT Decision Analysis.,SYS394,
1716,,,9.67,Numerical techniques for finding the root of an equation.,MAT151,
1730,AD,X,9.67,What is the difference between procedural programming and event driven programming? ,COS265,In event driven programming&#44; the program does nothing except listen for events. Once an event happens&#44; specific code is run. In procedural programming&#44; each line of code simply executes after the line before it. An event is anything that the program can detect&#44; such as a button getting clicked or the system clock reaches a certain time.
,,,,deterministic?,,
1023,,X,9.67,Can you name a partially ordered data structure? What does it mean that data is partially ordered?,COS265,No. I can't.
1026,,X,9.67,You are creating a pipelined processor in which all instructions have 8 steps. Whatis the best speedup you can achieve using pipelining?,COS230,Technology in the future. Because it doesn't exist.
616,,X,9.67,,COS381,Yes
172,,,9.67,How would you decide whether to go with a 2 tier or 3-tier design?,SYS394,
410,,,9.67,"What is a trie (""try"") and what is it used for?",COS320,
1038,,,9.67,What are some operations that might be used to pre-process an image before attempting to . . .,COS351,
1067,AK,X,9.67,ISA/ISD: What is the definition of quality?,SYS390,Conformance to requirements
507,,,9.67,What are the three main clauses in an SQL command and the purpose of each?,COS341,
1317,,,9.67,Explain the format and use of a Kepner-Tregoe decisions analysis (DA).,SYS394,
1336,SRW,X,9.67,How does a linked list work?,COS121,A bunch of nodes that each contain a payload and a pointer to the next node
1340,,,9.67,What does it mean to normalize a database? Why is it important?,N/A,
1358,,,9.67,What makes regular expressions more powerful than text searching?,COS264,
1359,,,9.67,Explain one approach to numerical root solving.,MAT151,
1307,,,9.67,"I just compiled a C file and received the following assembly file. What C file did I start with? .text .globl main .type main&#44; @function main: leal 4(%esp)&#44; %ecx andl $-16&#44; %esp pushl -4(%ecx) pushl %ebp movl %esp&#44; %ebp pushl %ecx subl $16&#44; %esp movl $0&#44; -12(%ebp) movl $0&#44; -8(%ebp) jmp .L2 .L3: movl -8(%ebp)&#44; %eax addl %eax&#44; -12(%ebp) incl -8(%ebp) .L2: cmpl $9&#44; -8(%ebp) jle .L3 movl -12(%ebp)&#44; %eax addl $16&#44; %esp popl %ecx popl %ebp leal -4(%ecx)&#44; %esp ret .size main&#44; .-main .ident ""GCC: (GNU) 4.1.2 (Gentoo 4.1.2)"" .section .note.GNU-stack&#44;""""&#44;@progbits",COS284,
1374,,,9.67,The influencing process begins with A. motivating others through ethical leadership B. motivating others through the proper use of power C. motivating others through the proper use of politics D. setting an objective E. motivating others through creating trust,IAS330,
,,,,,,
,,,,,,
,,,,,,
,,,,,,
,,,,,,
,,,,,,
1516,,,9.67,Why is it important for trees to be balanced?,COS265,
1523,SRW,X,9.67,Can a^n b^n be accepted by a FA?,COS435,Yes
1528,,,9.67,How are the public and private keys in a public/private key system used?,N/A,
1333,,,9.56,What is Test Driven Development (TDD)? Explain why it is an effective technique for creating code with low defect rates.,COS340,
1121,AK,X,9.55,What are the decimal values of 0101 1100? hexidecimal?,COS284,The decimal value is 92 and the hex value is 0x5c
1271,,,9.54,How can branch prediction work?,COS381,
1624,,,9.5,What is a system response table?,SYS394,
1643,,,9.5,Computer Vision,COS351,
,,,,What are some basic approaches to edge detection?,,
811,DKK,X,9.5,Stack vs. Queue,COS121,Data in a Stack is accessed in reverse order that it is inserted (Last In First Out). Data in a Queue is accessed in the same order it is inserted (First In First Out). Both a Stack and a Queue can be represented by an array or linked list. Push refers to inserting data and Pop refers to extracting data from a Stack/Queue
826,,,9.5,types of searching in AI applications,COS280,
,,,,example,,
81,,,9.5,"What is the concept of ""refraction"" in a rule based language like CLIPS?",SYS352,
837,,X,9.5,What are the different datatypes in Perl?,N/A,Did we even study this?
314,,X,9.5,Distinguish between a breadth first and a depth first search? Illustrate on the board.,COS252,Draw a picture of a tree. Literally.
305,,,9.5,What is the degree of a vertex in a graph?,COS252,
233,,,9.5,In Visual Basic&#44; what are Methods? Give a couple of examples.[follow on] What is the syntax of how they are called?,COS240,
859,MCW,X,9.5,AJAX - how does it work?,COS264,AJAX is NOT a language or technology in itself; but uses a combination of HTML&#44; CSS&#44; DOM (accessed with Javascript)&#44; asynchronously exchanging of data from browser to server avoiding page reloads&#44; and returning data formats from server to browser in plain text&#44; JSON&#44; or XHTML to name a few.
864,NJC,X,9.5,Discuss static and dynamic memory allocation.,COS121,Static memory allocation refers to the process of allocating memory at compile-time before the associated program is executed and dynamic memory allocation is where memory is allocated as required at run-time.
512,,,9.5,What is a transaction management system?,COS341,
61,AS,X,9.5,What is an ERP system?,SYS310,Enterprise Resource Planning - integrates internal and external data across an entire company (finance&#44; manufacturing&#44; customer service&#44; sales&#44; etc..)
168,,,9.5,What is the difference between systems analysis and design?Systems analysis (ISA) focuses on logical&#44; implementation-independent aspects of asystem (i.e.&#44; requirements).Systems design (ISD) deals with the physical or implementation-dependent aspects ofa system (i.e.&#44; technical specs).QUESTION:What are some questions that must be answer in the creation of Physical Data FlowDiagrams?,SYS394,
955,,,9.5,What are some scheduling algorithms an OS might use?,N/A,
23,,,9.5,What are the components of an ERD?,SYS200,
1202,,,9.5,What is the principle of least priviledge?,N/A,
1222,,X,9.5,What's the basic process of conducting a Kepner-Tregoe decision analysis?,SYS394,1. Write a concise decision statement 2. Specify objectives and divide into 'Musts' and 'Wants' 3. Evaluate each option against musts 4. Weigh each want from 1-10 5. Evaluate each option against wants 
1304,,,9.5,two types of A2D coversion.,N/A,
1434,AK,X,9.5,what is a recurrence relation?,COS 265,"In mathematics&#44; a recurrence relation is an equation that recursively defines a sequence&#44; once one or more initial terms are given: each further term of the sequence is defined as a function of the preceding terms.The term difference equation sometimes (and for the purposes of this article) refers to a specific type of recurrence relation. However&#44; ""difference equation"" is frequently used to refer to any recurrence relation."
1452,,,9.5,Give an example of ambiguity in Natural Language Processing. How is it dealt with computationally?,N/A,
1589,,,9.5,three lifecycle paradigms,N/A,
1590,MCW,X,9.5,How does virtual memory work?,N/A,"When RAM is insufficient while running applications simultaneously&#44; a computer looks at how much of that memory hasn't been used recently by an application and copies that memory to the hard drive. When switching between applications&#44; the now virtual memory exchanges the memory from the hard disk to the RAM allowing supposed ""unlimited"" RAM."
1605,,,9.5,Describe the purpose and process of Wideband Delphi.,N/A,
1255,,,9.4,Discuss the concept of skeletons&#44; motion constraints&#44; and degrees of freedom when animating creatures.,COS425,
1638,,,9.33,How are key frames used in animation?,COS425,
1552,,,9.33,Compare and contrast the roles of crossover versus mutation in genetic algorithms.,SYS411,
1668,,,9.33,How does a forward chaining expert system work?,N/A,
1672,,,9.33,What is meant by 2's complement representation and why is it used?,N/A,
1677,,,9.33,What is the basic idea of numerical integration?,MAT151,
1694,,,9.33,What are the key concepts behind the Scrum agile development methodology?,SYS394,
1698,,,9.33,What is the purpose and basic form of a KT decision analysis?,SYS394,
1696,,,9.33,Recalling Dale carnegie and How to Win Friends and Influence People&#44; what principles have you learned to win people to your point of view?,IAS330,
1718,AK,X,9.33,Give an overview of the process of communicating securely using a public-key cryptosystem (e.g.&#44; RSA).,MAT215,RSA is an algorithm for public-key cryptography that is based on the presumed difficulty of factoring large integers&#44; the factoring problem. RSA stands for Ron Rivest&#44; Adi Shamir and Leonard Adleman&#44; who first publicly described it in 1977. Clifford Cocks&#44; an English mathematician&#44; had developed an equivalent system in 1973&#44; but it was classified until 1997. A user of RSA creates and then publishes the product of two large prime numbers&#44; along with an auxiliary value&#44; as their public key. The prime factors must be kept secret. Anyone can use the public key to encrypt a message&#44; but with currently published methods&#44; if the public key is large enough&#44; only someone with knowledge of the prime factors can feasibly decode the message. Whether breaking RSA encryption is as hard as factoring is an open question known as the RSA problem.
1722,,,9.33,Why is a TM more powerful than an FSA?,N/A,
1737,,X,9.33,What are CSS selectors?,COS143 / COS264,CSS Selectors are pattern matching rules that determine which elements are styled according to which rule.  (HTML Example - div.info)
87,,,9.33,What is salience and how is it used in CLIPS?,SYS352,
127,,,9.33,Compare systems analysis and systems design.,SYS390,
986,,,9.33,What is the difference between continuous and discrete models? Give an example of each.,N/A,
244,,,9.33,What is an Abstract Data Type and why would one want one?,COS250,
1017,,X,9.33,What is appropriate technology? And why should I care about?,N/A,care about what?
1029,,,9.33,What are some addressing modes on the MIPS architecture?,N/A,
453,,,9.33,What is a protocol? What is it for?,COS331,
617,,,9.33,What is a memory hierarchy and why do memory hierarchies exist?,COS381,
1078,,,9.33,Explain the principle of a divide and conquer algorithms. Give an example.,COS120,
1105,,,9.33,server side components,,
1218,,,9.33,In project scheduling&#44; what is the basic idea of a critical path?,SYS394,
1243,MCW,X,9.33,How do stacks work?,COS121,A stack is an abstract data structure which follows a LIFO (last in first out) method. In programming&#44; however&#44; the stack is a static allocation of memory and stores function parameters. These parameters can be popped out directly by functional call or have the top popped off in LIFO order.
1259,,,9.33,What are cascading style sheets?,COS143/COS,
1289,,,9.33,What is the approximate percentage of large software projects that are canceled outright? That are late&#44; over budget&#44; or feature-poor?,COS340,
1329,,,9.33,What is AJAX? And&#44; why is it so popular?,COS243/264,
1337,,,9.33,Explain the form and use of a Kepner-Tregoe Decision Analysis (DA).,SYS394,
1370,,,9.33,What are b2b apps?,N/A,
1485,,,9.33,What is the process that takes place from when a user enters a URL (e.g.&#44; www.google.com) in the browswer until the web page is displayed?,COS143/COS,
1527,,,9.33,What is a Java Interface? Why is this concept important?,COS265,
1563,,,9.33,Design question - as soon as you started connecting in1 and in2 in the multiplexor&#44; there was a design problem . . .,N/A,
1611,,,9.33,What is database normalization and why is it important?,N/A,
1613,,,9.33,_____ programs are planned special efforts to recruit&#44; hire&#44; and promote women and members of minority groups. ,IAS330,
,,,,,,
,,,,A. Reverse discrimination,,
,,,,B. Affirmative action,,
,,,,C. Privacy,,
,,,,D. Discrimination,,
,,,,E. Americans with disabilities,,
1250,NJC,X,9.26,How does a stack work?,COS121,A stack uses the last in&#44; first out (LIFO) method. This is also known as pop and push. When an object that is placed in the stack is goes to the back or the bottom of the stack which is known as the push. If you remove an object from a stack you remove it from the top of the stack which is known as the pop.
1122,,,9.25,What methods do you use to approach reading a CS research paper?,COS310,
613,,,9.25,Thinking of computer processor architecture&#44; what is pipelining?,COS381,
1420,,,9.2,What is the difference between compiled and interpreted code?,COS382,
352,NJC,X,9.18,What is CSS? What is its main purpose?,COS264,CSS means Cascading Style Sheet. This is the file that hold all the code that makes a webpage look pretty. 
1230,,,9.18,Why do modern architectures have a memory hierarchy?,COS284,
1132,,,9.17,Describe what pipelining is. Why is it used in modern architectures?,COS381,
1180,aac,X,9.17,"Explain the concept of event handlers.  Explain the following code - include objects involved: Button change = new Button(shell&#44; SWT.PUSH); change.setText(""Change Null""); change.addListener(SWT.Selection&#44; new Listener() { public void handleEvent(Event e) { do_something_appropriate(); } });",COS265,Event handlers are pieces of codes that handle events such as click&#44; hover&#44; etc. This code creates a new button that has a push function. change.setText changes the text displayed on the button to Change null. Then&#44; you add an event listener to the button which handles the push event and does something appropriate.
,,,,,,
,,,,,,
