Question ID,Contributor aka Name,In Progress / Finished,Avg Result,Question,Class, Answer
1165,,,8.25,What key project characteristics of a software project or customer organization argue in favor of an agile development methodology as opposed to a prescriptive one?,COS340,
383,,,8.22,How is the complexity of an algorithm measured?,COS320,
257,,,8.2,What is an array? [follow on] How are strings and arrays related?,COS250,
1216,,,8.18,What is a Kepner-Tregoe situation appraisal and what is its purpose in a system development methodology?,SYS390,
1211,,,8.17,If you saw the following performance data for an algorithm&#44; what would be its complexity?,COS265,
,,,,N time(N),,
,,,,1024 1.00,,
,,,,2048 2.15,,
,,,,4096 4.7,,
1178,,,8.17,Why should a web page separate content and presentation?,COS264,
353,,,8.17,Describe Javascript.,COS264,
1112,,,8.15,How does a binary tree work?,COS121,
1251,,,8.13,Describe the various ways the List ADT can be implmented.,COS121,
1128,,,8.06,How does SE differ from programming?,COS340,
1177,,,8.06,Describe the Javascript language.,COS264,
1621,,,8,What is the simplex method?,N/A,
1629,,,8,"Why did Amazon ""win"" the online retail competition?",SYS310,
1654,,,8,Divide and conquer algorithm . . .,N/A,
1732,,,8,what is the truth table for f = (a' b')c ?,N/A,
1754,,,8,If you run code in a situation where interrupts can fire&#44; what are the risks of running instructions that are not atomic?,N/A,
812,,,8,PHP&#44; perl&#44; javascript,N/A,
818,,,8,What is a pointer?,N/A,
821,,,8,differences in web design from artistic and programming standpoint,N/A,
275,,,8,Name two search algorithms.[follow on] Describe the algorithm used in the XXX search.,COS250,
827,,,8,simulation - continous vs discrete sim,N/A,
,,,,example of each,,
289,AK,X,8,What is a recurrence relation? [follow on] Give an example.,COS252,"In mathematics&#44; a recurrence relation is an equation that recursively defines a sequence&#44; once one or more initial terms are given: each further term of the sequence is defined as a function of the preceding terms. The term difference equation sometimes (and for the purposes of this article) refers to a specific type of recurrence relation. However&#44; ""difference equation"" is frequently used to refer to any recurrence relation."
846,,,8,Balanced trees - definition - whyimportant,N/A,
144,,,8,What are four components you expect to find in a DFD?,SYS390,
849,,,8,Main characteristics of OO languages?,N/A,
852,,,8,Main components of AJAX - main idea of how it functions,N/A,
524,,,8,Describe some different types of light sources.,COS350,
867,,,8,How do you maintain integrity in a database?,N/A,
868,,,8,How do you calculate the complexity of a recursive function?,N/A,
334,,,8,"Regular expressions are used in several languages (Perl&#44; Java&#44; PHP) to find and/ormodify patterns in strings. On the board&#44; show us regular expressions that do thefollowing.find ""allan"" in the default stringfind ""allan"" but only at the beginning of a linesubstitute ""Allan"" for ""allan"" everywhere",COS264,
883,,,8,Define negative feedback and describe why it used in systems problems.,N/A,
893,,,8,Compare and contrast two types of serial communication.,N/A,
297,,,8,"What does it mean if a function is ""one to one""?",COS252,
917,,X,8,What are the differences between single-mode and multi-mode fiber-optic cables?,N/A,number of modes
921,,,8,Describe the minimax search algorithm.,N/A,
925,,,8,Describe how entropy&#44; enthalapy&#44; Gibbs free energy and phase transformations are related.,N/A,
629,,,8,What does CISC stand for and why does it exist?,COS381,
950,,,8,Describe to me how a SAR works.,N/A,
679,,,8,What is an abstract base class? Why would someone use an abstract base class?,COS250,
991,,,8,How do you search for information in a graph?,N/A,
333,,,8,What is one of the most powerful features of Perl? Describe what it can do.,COS264,
345,AS,X,8,What are cookies?,COS264,Pieces of data transmitted across the web stored in a user's browser that can be referenced by the web page they oriented from to access a user's previous activity or data.
68,,,8,What distinguishes a knowledge based system from any other system?,SYS352,
973,SRW,X,8,What does the exec() system call do?,COS284,Re-associates the current thread with a new program.
1012,,,8,Tell us about regular expressions.,N/A,
343,,,8,What are some of the functions that can be performed by PHP?,COS264,
59,,,8,When a businessman talks about Supply Chain&#44; what does he have in mind?,SYS310,
1030,,,8,How does a web browser use AJAX to update a web page?,N/A,
424,,,8,Describe several different LAN topologies.,COS331,
1040,,,8,Describe the different uses of a timer in a microcontroller.,N/A,
1044,,,8,Draw and describe a transistor and relate to its performance.,N/A,
1045,,,8,Describe the characteristics of a Linear system&#44; and discuss how one might model/analyze a non-linear system.,N/A,
1048,,,8,Describe how a SAR works&#44; and what are its advantages/disadvantages of this compared to other methods.,N/A,
1052,,,8,What the fundamental rules for an ideal Op-Amp? What is the gain of such an op-amp and why?,N/A,
387,,,8,What does it mean to balance a tree?,COS320,
653,,,8,What considerations does a computer architect look at when designing aninstruction set? Why?,COS381,
311,,,8,How do Huffman codes relate to trees?,COS252,
1109,,,8,How does an HTML packet get from CNN.com to your browser?,,
1199,,,8,What is the difference between forward and backward chaining?,N/A,
1219,,,8,Explain the basic structure of an ASP web server?,N/A,
1239,,,8,What is a context free grammar? Is English context free?,N/A,
1241,,,8,In project scheduling&#44; what is a critical path?,N/A,
1283,,,8,ethical conflict. Rank importance to: yourself&#44; employer&#44; society&#44; customer.,N/A,
1286,,,8,critically damped&#44; underdamped&#44; and overdamped,N/A,
1318,,,8,What are some ways queues are used in simulations?,N/A,
1332,,,8,Assume a floating-point representation that uses the following characteristics:,COS284,
,,,,1. 4-bit (excess 7) exponent,,
,,,,2. 3-bit significand,,
,,,,3. 8-bit total size,,
,,,,,,
,,,,What is the representation of 4.75?,,
1351,,,8,In project scheduling&#44; what is a critical path? What does it tell us about the delivery schedule for the project?,N/A,
1360,,,8,What is a Hamiltonian cycle?,N/A,
1369,,,8,Explain the difference between vector and raster image formats.,N/A,
1378,,,8,Why bother using CSS?,N/A,
1385,,,8,How is animtion in Flash different than animation in Maya?,N/A,
1394,,,8,In project scheduling&#44; how does the critical path relate individual tasks to the delivery schedule for the overall project?,N/A,
1443,,,8,image processing - what is a kernel? How is i tused?,N/A,
1460,,,8,Is software engineering a profession in the truest sense? Explain how ethics fits into this line of work.,N/A,
1468,,,8,What is a critical path and how is it calculated?,N/A,
1198,,,8,What are some other jobs that a systems analyst is qualified to do?,SYS392,
1559,,,8,What is an abstract data type (ADT)?,N/A,
1399,,,8,Why is the instruction set architecture set so important to both software and hardware developers?,COS381,
1575,,,8,Draw the binary search tree that would get created by inserting 2 5 8 1 23 25&#44; in that order. Are there any problems with a tree that looks like this?,N/A,
1587,,,8,sequential file processing limitations and ways to work around,N/A,
1321,,,7.9,How do C/C++ pointers work?,COS121,
1185,,,7.86,"Comment on the usability of <a href=""http://stevenscreek.com/iPhone/images/TripLogMain.jpg"">TripLog/1040</a>&#44; an iPhone app.",COS314,
279,,,7.86,What is the big-Oh complexity of the following algorithm: Stack<char> values; char temp; while (cin >> temp) { values.push(temp); } while (!values.isEmpty()) { cout << values.pop(); },COS250,
329,,,7.83,What types of information can be transmitted using HTML?,COS264,
531,,,7.83,What are some of the features of polygonal modeling?,COS350,
1172,,,7.8,Explain what a system development methodology is and the underlying principles,SYS390,
1309,,,7.8,"How can an office be best organized to allow heads-down developers to get and remain ""in the zone"" for productive programming.",COS340,
247,,,7.8,What does it mean to have public and private variables and methods in an object/class?,COS250,
276,,,7.8,Name two non-optimal sorting algorithms. What are their time complexities?,COS250,
1184,,,7.79,What is the role of documentation for a program or web site?,COS314,
1440,,,7.75,Describe the typical configuration of and parameters for a genetic algorthm.,SYS411,
1353,,,7.73,Discuss the role of containers and layout managers in GUI design.,COS265,
1288,,,7.7,How does unit testing differ from integration testing?,COS340,
1155,,,7.69,Give an example of a divide and conquer algorithm. How are these algorithms typically implemented?,COS265,
1622,SRW,X,7.67,How does proof by induction work?,N/A,First prove for 1. Then prove for n+1. Now you have proved for all cases.
1647,SRW,X,7.67,What characterizes the lisp programming language? What are its strengths?,N/A,Lots of parentheses. Allows programming from the bottom up. Can be used to very quickly write functions. Great for processing lists.
1653,,,7.67,Why should content and presentation be separated? How is this done?,N/A,
1197,,,7.67,Define business process reengineering and the methodolgy for applying the concepts.,SYS390,
1665,,,7.67,What is appropriate technology?,N/A,
1682,,,7.67,What does it mean to say an algorithm is O(n^2)?,N/A,
1685,,,7.67,Why is there so much flash content on the web?,N/A,
1755,,,7.67,What is the logic function of the given two-diode circuit?,N/A,
897,,,7.67,What are the possitive and negative effects of your project for society?,N/A,
929,,,7.67,What are the ACID properties for databases?,N/A,
214,,,7.67,Describe the two basic mechanisms of time keeping used in simulation.[follow on] When would you choose one over the other?,SYS402,
175,,,7.67,"What is the ""Triple Constraint"" of Project Management?",SYS394,
992,,,7.67,What is a pointer? Why are they considered dangerous?,N/A,
528,,,7.67,How many frames a second are needed to make animation by successive images acceptable?And why?,COS350,
1003,,,7.67,Why use prototyping as a development methodology?,N/A,
325,,,7.67,What does HTTP stand for and what is it used for?,COS264,
1057,,,7.67,What does polymorphism mean in an object oriented language?,N/A,
1263,,,7.67,In project scheduling&#44; how do you determine which tasks cannot be slipped in order to stay on schedule?,N/A,
1455,,,7.67,What is a hash table?,N/A,
1254,,,7.67,If you are creating a model that will be used in an animation&#44; what are some additional considerations?,COS425,
1478,,,7.67,waterfall vs. agile,N/A,
1493,,,7.67,What are the properties of a BST?,N/A,
1501,,,7.67,Give two different ways that a web application can ensure that user input is valid.,N/A,
1519,,,7.67,If someone offers to sell you the intellectual property rights to a new O(N) general purpose sorting algorithm&#44; would that be something worth investing in?,N/A,
1574,,,7.67,Operations Research - what is the basic idea of linear programming?,N/A,
967,,,7.6,What is the principle of locality? How does the memory hierarchy take advantage of it?,COS284,
839,,,7.58,What is visibility w.r.t. HCI?,COS314,
1364,,,7.53,Describe the different Perl datatypes.,COS264,
1645,,,7.5,Why is the computer science community pursuing machine-based learning programming? What is the benefit?,N/A,
1272,,,7.5,Explain the difference between sequential and combinational logic.,COS381,
1133,,,7.5,How do architectures deal with data hazards?,COS381,
536,,,7.5,Describe OpenGL. What is it? What can it do? How do you use it?,COS350,
335,,,7.5,What is Java?,COS264,
822,,,7.5,discrete simulation&#44; continuous simulation,N/A,
619,,,7.5,What is the purpose/objective of cache memory?,COS381,
835,,,7.5,Why is balance important for a tree? How do you keep a tree balanced?,N/A,
836,,,7.5,Example of divide and conquer algorithm. Example of greedy algorithm.,N/A,
838,,,7.5,What is virtual memory?,N/A,
870,,,7.5,State definition of ADT,N/A,
633,,,7.5,Describe two's complement representation of negative binary numbers.,COS381,
106,,,7.5,What are Crosby's four absolutes wrt systems analysis?,SYS390,
1,,,7.5,What are some major personality traits that affect how people interact in projectteams?,IAS330,
904,,,7.5,What is the difference between static and dynamic memory allocation - problems with either?,N/A,
923,,,7.5,List and describe several memory addressing modes.,N/A,
927,,,7.5,Given a box of resistors&#44; capacitors&#44; some batteries a voltmeter and timer&#44; how would you experimentally determine the voltage as a function of time for the series RC circuit.,N/A,
953,,,7.5,How do you measure the complexity of a sort algorithm?,N/A,
1009,,,7.5,What if you wanted to print all the elements in the binary search tree - how would you do it? What is the complexity?,N/A,
491,,,7.5,What are some strategies for enhancing team jell? (Peopleware),COS340,
1301,,,7.5,1 KHz square wave&#44; sketch fourier space representation,N/A,
1303,,,7.5,how does heat dissipation work on circuit drawn?,N/A,
1433,,,7.5,Example problem where NN not good approach?,N/A,
1565,,,7.5,What are the differences between electric field and magnetic field?,N/A,
1134,,,7.43,How are syntax and grammar related?,COS382,
1389,,,7.42,What decimal value does the twos complement value 0101 represent? What about 1111?,COS284,
1256,,,7.4,Discuss the concept of key frame animation. What parameters can be key-framed?,COS425,
442,,,7.38,What is parity and what is it used for?,COS331,
1441,SRW,X,7.36,"Define ""machine learning"".",SYS411,"Subfield of artificial intelligence. Deals with algorithms that can ""learn"". They take information as input and try to come up with patterns or ways of interpreting the data in order to make decisions."
1620,,,7.33,What are three ways to traverse a tree? What is the complexity of tree traversal?,N/A,
1693,,,7.33,What is big-oh complexity of binary search?,N/A,
1720,,,7.33,How is event driven programming different than procedural programming?,N/A,
1735,,,7.33,Describe the basic behavior of a public key cryptosystem.,N/A,
473,,,7.33,Describe the major tasks involved in project scheduling.,COS340,
229,,,7.33,Describe the salient points of a normal curve.,CEN493,
9,,,7.33,What are the 5 levels in Maslow's Needs Hierarchy?,IAS330,
931,SRW,X,7.33,How do you do proof by contradiction?,N/A,Provide a counterexample.
935,,,7.33,Compare/Contrast Perl and PHP.,N/A,
938,,,7.33,What are strengths/weaknesses of GUIs?,N/A,
983,,,7.33,What are some strengths of Flash vs. other web technologies?,N/A,
984,,,7.33,Compare flash and Maya for animation.,N/A,
995,,,7.33,Compare Javascript and Flash.,N/A,
489,,,7.33,"What are some characteristics of a ""jelled"" team? (Peopleware)",COS340,
1065,,,7.33,What is AJAX? How does it work?,N/A,
1080,,,7.33,What is an associative entity (DB)?,N/A,
1099,,,7.33,What is a BST?,N/A,
1220,,,7.33,Compare/contrast discrete vs. continuous simulations.,N/A,
1225,,,7.33,What is done during a security audit?,N/A,
1265,,,7.33,Web site design - how will artists and ,N/A,
,,,,"""geeks"" look at the process differently?",,
1120,,,7.33,Given a 32-bit architecture with a 4MB&#44; 64-byte block&#44; 4-way associative L2 cache&#44; how would the machine decide where to find the data located at memory address 0x0a1b2c3d?,COS284,
1495,,,7.33,What does it mean to separate content from presentation? Why should it be done?,N/A,
1556,,,7.33,What is computational complexity? What is the complexity of binary search?,N/A,
1607,,,7.33,What does it mean to normalize a database?,N/A,
1608,,,7.33,How is it possible for a modem/network encoding allow for multiple bits/baud?,N/A,
1365,,,7.29,How can you tell which shading algorithm (Gourard or Phong) was used by looking at a generated image? Why?,COS350,
513,,,7.25,In a TMS&#44; four important properties of every transaction are: atomic&#44; consistency&#44;isolation&#44; durability. What do these four properties mean?,COS341,
1154,,,7.23,How does a web browser communicate with a server to get content to display (e.g.&#44; how does a browser display the Google home page?)?,COS264,
1229,,,7.23,What is the principle of locality? How does the memory hierarchy take advantage of it?,COS284,
1161,,,7.22,For what types of problems are approximation algorithms needed? What is a ratio bound?,COS320,
1124,,,7.2,Briefly describe one MST algorithm. What paradigm does it follow.,COS320,
1419,,,7.2,How does a cache work on the principle of locality?,COS381,
1157,,,7.18,What is an optimization that an application programmer may apply to their code to execute efficiently on an architecture with a memory hierarchy? You may use a matrix-matrix multiply as an example if one does not come to mind.,COS284,
1355,,,7.17,Solve the following recurrence relation:,COS320,
,,,,C(n) = n + c(n-1),,
1313,,,7.15,Compare and contrast forward versus backward chaining as reasoning strategies.,SYS352,
540,,,7.11,What is DirectX? Who developed it?,COS350,
1322,,,7.1,How would the DOM look for the following web page:,COS264,
,,,,,,
,,,,<html>,,
,,,,<head>,,
,,,,<title>Example page</title>,,
,,,,</head>,,
,,,,<body>,,
,,,,<p>This is a short web page.</p>,,
,,,,</body>,,
,,,,</html>,,
1142,AK,X,7.07,Why is RSA encryption secure? Cite two distinct major points.,MAT215,RSA is an algorithm for public-key cryptography that is based on the presumed difficulty of factoring large integers&#44; the factoring problem. RSA stands for Ron Rivest&#44; Adi Shamir and Leonard Adleman&#44; who first publicly described it in 1977. Clifford Cocks&#44; an English mathematician&#44; had developed an equivalent system in 1973&#44; but it was classified until 1997. A user of RSA creates and then publishes the product of two large prime numbers&#44; along with an auxiliary value&#44; as their public key. The prime factors must be kept secret. Anyone can use the public key to encrypt a message&#44; but with currently published methods&#44; if the public key is large enough&#44; only someone with knowledge of the prime factors can feasibly decode the message. Whether breaking RSA encryption is as hard as factoring is an open question known as the RSA problem.
1175,SRW,X,7,How do you develop recursive algorithms?,COS121,Write a function that calls itself. More specifically&#44; you want to have a base case and a recursive case. The base case indicates when to stop recursing&#44; and is what you eventually want to reach. The recursive case(s) call the function again.
1635,SRW,X,7,How do neural networks function? What types of problems are the good for solving?,SYS411,"Basic unit is a perceptron. Takes input and applies a function to it to determine if it will ""fire"" or not (produces output). Many of these can be linked together to form a network. To make a useful neural net&#44; feedback is crucial. This means that the network changes if perceptrons fired incorrectly. Over time&#44; the network will become better at doing its job."
1151,,,7,What are the three fundamental control structures that may be combined to solve any problem for which an algorithm can be described?,COS120,
1314,,,7,Name some synonyms for the two parts of a rule and describe the function of these two parts.,SYS352,
1593,,,7,What is meant by the terms:,COS382,
,,,,memory leak,,
,,,,garbage collection,,
1207,,,7,What is event-based programming in a windows environment? How does it relate to procedural coding?,COS240,
1695,,,7,Explain the concept of event handlers. When are they executed?,N/A,
1210,,,7,What is the exact operation count and big-oh complexity for:,COS265,
,,,,for i = 1 to n,,
,,,,for j = 1 to n-1,,
,,,,do_some_work O(1),,
1715,,,7,Hash table - purpose?,N/A,
1750,,,7,What is the thevenin equivalent to the given circuit?,N/A,
,,,,What is the load line?,,
422,,,7,What are some common types of wireless transmission media? Give a use for each one.,COS331,
439,,,7,What is the purpose of multiplexing? [follow on] Identify different methods of multiplexingand describe one.,COS331,
232,,,7,In Visual Basic&#44; what are controls and how are they used? Give some examples.,COS240,
855,,,7,Explain the concept and importance of virtual memory.,N/A,
336,,,7,How is Java executed?,COS264,
285,,,7,If you were to represent items in an online shopping cart&#44; which would you use&#44;and why?,COS250,
876,,,7,What is a hash table?,N/A,
889,,,7,What factors affect communications range in an RF link as calculated by Friis formula?,N/A,
903,,,7,What are critically damped&#44; under damped&#44; and over damped.,N/A,
,,,,,,
909,,,7,Describe the design process you used for your project and describe why it is important to follow a design process.,N/A,
910,,,7,Name some types of registers in a processor and what they are used for,N/A,
913,,,7,State several different types of transistors and compare and contrast them.,N/A,
930,,,7,Discuss polygonal and NURBS models.,N/A,
937,,,7,What is an exception? How are they handled in Java/C ?,N/A,
143,,,7,What are the diagrams created during processing modeling in Systems Analysis?,SYS390,
949,,,7,Compare and contast differnt types of serial communication.,N/A,
,,,,,,
538,,,7,What are some issues involved in shading an object?,COS350,
576,,,7,What are some ways in which digitized images can be enhanced to make features of interestmore visible?,COS351,
1025,,,7,What is a greedy algorithm? Give an example.,N/A,
433,,,7,Describe two types of flow and error control.,COS331,
1053,,,7,What is strong AI? Weak AI?,N/A,
975,,,7,Describe a method for measuring the performance of a portion of an application.,COS284,
1058,,,7,How does a stack overflow exploit work?,N/A,
1060,,,7,Explain how a neural network works.,N/A,
1072,,,7,How does flash differ from Maya?,N/A,
1073,,,7,How would you decide when to queue and when to use a stack in some problem?,N/A,
299,,,7,What is the pigeonhole principle?,COS252,
1077,,,7,How do you compute the complexity of a recursive algorithm?,N/A,
1081,,,7,What is database normalization? Why might a database be normalized? When might it be better not to normalize?,N/A,
14,,,7,What does a systems analyst do?,SYS200,
1093,,,7,How do you compute complexity for recursive functions?,N/A,
1097,,,7,main componenets of ERD,N/A,
1183,,,7,What are the two main functions of a (static) linker?,COS284,
1221,AK,X,7,What is a recurrence relation?,COS265,"In mathematics&#44; a recurrence relation is an equation that recursively defines a sequence&#44; once one or more initial terms are given: each further term of the sequence is defined as a function of the preceding terms.  The term difference equation sometimes (and for the purposes of this article) refers to a specific type of recurrence relation. However&#44; ""difference equation"" is frequently used to refer to any recurrence relation."
1278,,,7,Shown is a picture of snow forming on a chain length fence. Describe why the ice crystals are forming on the fence.,ENP352,
1274,,,7,What are the differences between single-mode and multi-mode fiber-optic cables?,ENP321,
1352,,,7,What's a system? ,N/A,
,,,,What are its basic components? ,,
,,,,Give an example.,,
1368,,,7,What are the gulfs of evaluation and execution?,N/A,
1412,,,7,A new battery technology has just been developed&#44; how would you determine the voltage - current relationship for this battery technology,N/A,
1414,,,7,Describe how SAR A/D works,N/A,
1423,,,7,Why are GPUs becoming a viable architecture for general purpose computation?,COS381,
1457,,,7,How would you define the word privacy? What issues should we take into consideration in our society in terms of data gathering and dissemination?,N/A,
1490,,,7,What is a vertex shader in the context of video graphics card programming?,N/A,
1164,,,7,"What are some common ""code smells"" that indicate poor software design and suggest refactoring?",COS340,
1534,,,7,from ENP341: In data conversion&#44; explain the difference between accuracy and precision. calculate the precision of an 8 bit 5V ADC.,N/A,
1535,,,7,from ENP331: explain the concept of impedance.,N/A,
1541,,,7,Suppose a system G with input x and output y has a transfer function (gain) that varies from 1 to 2. How would you use negative feedback to produce a more accurate gain of 1.5?,N/A,
1558,,,7,What is a regular expression? Where might one be useful?,N/A,
1570,,,7,What is the philosophy behind RISC architectures&#44; and why is it thought to be better than classic CISC?,N/A,
1582,,,7,overall score,N/A,
1618,,,7,Why should presentation and content be separated?,N/A,
1237,,,6.96,What is the foundation of fuzzy logic when contrasted with classical set theory?,SYS352,
253,,,6.92,What is a pointer?,COS250,
1287,,,6.89,What is a communication protocol? Conceptually&#44; what two aspects of communication does a protocol specify?,COS331,
421,,,6.83,Compare twisted pair&#44; coaxial cable and fiber optics. Give pros and cons of each.,COS331,
541,,,6.83,There are three transformations that are common in changing objects in a 3-D model:scaling&#44; translating and rotating. What do each of these do?[follow on] Pick one and tell how it is accomplished.,COS350,
249,,,6.82,Tell us about recursive functions. Definition. Structure. Use. Motivation. Caveats.,COS250,
1181,,,6.79,How does twos complement representation work?,COS284,
428,,,6.75,How does packet switching improve on circuit switching?,COS331,
1372,,,6.71,What does this transformation accomplish? Why is the matrix 4x4?,COS350,
