Question ID,Contributor aka Name,In Progress / Finished,Avg Result,Question,Class, Answer
,,,,,,
,,,,,,
,,,,,,
,,,,,,
,,,,,,
,,,,,,
1153,,,9.17,Describe the capabilities of the VB.NET debugger - how is it typically used and what are its features?,COS240,
1416,,,9.13,What is a KLOC? Why is it a handy measure of project size? In what ways is it deficient?,COS340,
1162,,,9.13,Describe the difference between lossy and lossless compressions&#44; and tell when each might be used.,COS331,
1170,,,9,Describe the relationship of an expert system to a knowledge domain.,SYS352,
1637,,,9,Why separate functionality from presentation from content?,COS143/COS264,
1639,,X,9,Suppose someone asked you to invest in a company that is developing a new set of super performance sorting algorithms that can sort in O(N). Would investing in that company be a good idea?,N/A,Depends on their stock.
1656,,,9,How is edge detection performed?,COS351,
1129,,,9,Explain the idea of software version control.,COS340,
1713,,,9,Discuss the MVC design pattern.,N/A,
1269,,,9,Describe two methods for software requirements elicitation.,COS340,
1721,,,9,What is a finite state transducer? What is one way in which an FST is used in NLP?,N/A,
1753,,,9,What are the main considerations to be mindful of when developing firmware on an 8-bit microprocessor vs. a desktop system.,N/A,
819,,,9,differences between flash and maya,N/A,
251,,,9,Which of the sorting algorithms is easily conceived of as recursive? Why?,COS250,
75,,,9,Give examples of problem domains that could easily be represented in a rule-basedexpert system&#44; and ones that couldn't. Explain why or why not.,SYS352,
475,,,9,What are some of the components of software quality assurance?,COS340,
628,,,9,What does RISC stand for and why does it exist?,COS381,
831,,,9,example of a simulation that would be continous,N/A,
,,,,,,
,,,,example of a simulation that would be discrete,,
832,,,9,describe regular expressions - give an example,N/A,
151,,,9,Compare a black hole&#44; a gray hole and a miracle in the context of a DFD.,SYS390,
847,,,9,Data structure to track depth first search?,N/A,
16,,,9,What is transaction processing?,SYS200,
856,,,9,What is salience?,N/A,
282,SRW,X,9,Contrast deep and shallow copies.,COS250,Deep copy is stored in a separate memory address. Shallow copy just copies the value but is really just a pointer to the original.
866,,,9,Characteristics of OO languages?,N/A,
237,,,9,How are menus created in Visual Basic?,COS240,
878,,,9,virtual memory - why is it important&#44; overview of how it works,N/A,
884,,,9,Balance in search trees,N/A,
887,,,9,Does a wave with spikes contain high frequencies or low frequencies?,N/A,
652,,,9,Give me some memory addressing modes.,COS381,
888,,,9,Compare and contrast the compare and capture modes of a timer.,N/A,
894,,,9,What is an exponential algorithm? Give an example.,N/A,
905,,,9,Explain the operation of a successive approximation A to D converter.,N/A,
,,,,,,
916,,,9,Describe the effects of temperature and defects on the conductivity.,N/A,
919,,,9,"How difficult would it be to modify your project to support arbitrary precision ""floating point""?",N/A,
920,,,9,Draw a square wave and sketch the Fourier space representation of that square wave.,N/A,
241,,,9,What makes up a class or object in object oriented programming? [follow on] Illustrateby giving the definition of a class representing a queue.,COS250,
933,,,9,What are some advantages/disadvantages of Java?,N/A,
281,BN,X,9,Construct a BST using input as follows: 53&#44; 80&#44; 19&#44; 10&#44; 41&#44; 99&#44; 96&#44; 75&#44; 52&#44; 5.,COS250,[I have an answer for this&#44; but it's an image&#44; so I'm not sure what to do with it]
506,,,9,What is SQL and DML?,COS341,
941,,,9,What is the role of feedback in HCI?,N/A,
400,SRW,X,9,What is the difference between a binary tree and an n-ary tree?,COS320,Binary trees have at most 2 leaves per node&#44; n-ary trees have at most n leaves per node.
951,,,9,What is unit testing?,N/A,
980,,,9,What is AJAX? How do web sites change when using AJAX?,N/A,
985,,,9,How does a functional language differ from others (procedural&#44; object-oriented...)?,N/A,
972,AK,X,9,What does the fork() system call do?,COS284,Creates a copy of the running process so there are two parallel processes that are exactly the same
996,,,9,What is AJAX - how is it useful for web applications?,N/A,
997,,,9,How does a stack overflow attack work?,N/A,
1000,,,9,What is a DFD?,N/A,
520,,,9,What is data redundancy and what are the problems associated with it?,COS341,
169,,,9,How is a physical DFD different than logical DFD?,SYS394,
1019,,,9,Why did we study how human memory works?,N/A,
386,SRW,X,9,What is a binary search tree?,COS320,A directed acyclic graph in which each node has at most two branches.
382,,,9,Who was Alan Turing? What did he contribute to computer science?,COS320,
291,SRW,X,9,Contrast the union and intersection of two sets.,COS252,Union: members of either set or both. Intersection: members of both sets only.
1035,,,9,How does one conduct a security audit?,N/A,
458,,,9,What is the Rapid Application Development model (RAD)?,COS340,
1076,,,9,What is a HMM (used in natural language processing.) What is it used for?,N/A,
1084,AS,X,9,What is the DOM?,COS243 / COS264,Document Object Model - cross language platform that for interacting with HTML&#44; XHTML&#44; XML
1086,,,9,What is the difference between a queue and a stack? What type of thing might you use each to do?,N/A,
1088,,,9,Why is accessibility important?,SYS214,
1092,SRW,X,9,Describe how a genetic algorithm works.,SYS411,Start with an initial random population. Give each individual a fitness according to the fitness function. Apply some kind of pooling technique (e.g. binary tournament) to generate the pool of parents. Apply crossover and mutation operators to individuals in the pool to create a new population. Test for convergence. If true&#44; you are done&#44; else check fitness again and cycle through the process again.
1223,,,9,What is the simplex method?,N/A,
1238,,,9,In an unbounded search space&#44; would you prefer breadth-first or depth-first search? Why?,N/A,
1246,,,9,"Express this statement in first-order predicate calculus: ""Alice gives Bill an Apple.""",N/A,
1249,,,9,What is the most important idea in operations research?,N/A,
1261,,,9,How does a SQL stored procedure differ from in-line SQL? When would you use each?,N/A,
1262,NJC,X,9,What is utilitarianism?,COS311,The doctrine that actions are right if they are useful or for the benefit of a majority.
1293,,,9,What are the differences between a dipole and a parabolic antenna?,ENP321,
1300,,,9,define settling time&#44; rise time&#44; and percent overshoot,N/A,
1305,,,9,How is text searching (as done with trie data structure) different than string pattern matching?,COS265,
1339,,,9,In an RDBMS&#44; what is the primary purpose of a database transaction? Give an example.,N/A,
1383,,,9,What is key frame animation? Why is it important?,N/A,
1422,,,9,Difference between DFA and NFA? Power?,N/A,
1429,,,9,Complexity class P&#44; NP&#44; NP complete,N/A,
1430,,,9,"Follow up - NP - ""can't be done in polynomial time"" - I disagree",N/A,
1466,,,9,Describe Kepner-Tregoe decision analysis and give a business example in which it might be used.,N/A,
1480,,,9,Critical path,N/A,
1482,,,9,Name an algorithm and discuss its computational complexity.,N/A,
1487,,,9,What are the various levels of Maslov's hierarchy?,N/A,
1510,,,9,What is a regular expression? Why are they useful?,N/A,
1518,,,9,What is the concept of a divide and conquer algorithm? Give an example.,N/A,
1522,,,9,What could you do to ensure that a web application you are writing is secure?,N/A,
1540,,,9,What are the differences between electric field and magnetic field?,N/A,
1348,,,9,Compute 39 â€“ 89 using 8-bit representations using twoâ€™s complement.,MAT215,
1549,,,9,from ENP332: In a control system&#44; a system has an input x&#44; output y&#44; a forward gain G&#44; and a negative feedback gain H. draw a block diagram ,N/A,
,,,,representing this system&#44; and express the transfer function TF of the ,,
,,,,system y/x as a function of G and H.,,
1566,,,9,How would you test a battery to determine its equiv. ckt? What would be a simple equivalent circuit?,N/A,
1569,,,9,Suppose a system G with input x and output y has a transfer function (gain) that varies from 1000 to 2000. How would you use negative feedback to produce a more accurate gain of say 10 /-1%?,N/A,
1579,,,9,How do machines represent fractional numbers?,N/A,
1168,,,9,Symbolically express following argument: If my client is guilty&#44; then the knife was in the drawer. Either the knife was not in the drawer or Jason Pritchard saw the knife. If the knife was not there on October 10&#44; it follows that Jason Pritchard did not see the knife. Furthermore&#44; if the knife was there on October 10&#44; then the knife was in the drawer and also the hammer was in the barn. But we all know that the hammer was not in the barn. Therefore&#44; ladies and gentlemen of the jury&#44; my client is innocent.,MAT215,
1600,,,9,what do DFAs and NFAs do?,N/A,
1606,AS,X,9,Crosby's Four Absolutes,SYS101,1. The definition of quality is conformance to requirements 2. The system of quality is prevention 3. The standard of quality is zero defects 4. The measure of quality is the price of nonconformance
1315,,,9,Explain how project success depends on intelligent use of a system development methodology.,SYS390,
1610,,,9,Let's say that you wanted to improve performance of a C program. What are the best approaches? What should you try doing first? Would it be worth re-writing any part of the program in assembly language?,N/A,
1612,,,9,What is the purpose of the memory hierarchy?,N/A,
1117,,,8.88,How would you attempt to learn a new programming language (e.g.&#44; Perl 6)?,COS264,
200,,,8.83,Talk about the use of queuing structures in simulation.,SYS402,
272,,,8.83,Discuss binary search trees&#44; describing their structure and contents.,COS250,
1137,,,8.8,In the animation process&#44; how are particles and gases different than objects such as walls and tables?,COS425,
509,,,8.8,What is a primary key? What is a foreign key? How are they related?,COS341,
502,,,8.8,What is the essence of the client/server architecture?,COS341,
37,,,8.8,Describe B2B&#44; B2C&#44; and C2C relationships and illustrate each.,SYS310,
1357,,,8.8,What are the three types of instructions in the MIPS instruction set?,COS381,
348,,,8.78,Compare any two of the following languages: PHP&#44; Perl&#44; Java&#44; Javascript.,COS264,
690,,,8.78,What are some characteristics of object-oriented programming languages?,COS382,
1174,NJC,X,8.77,How does the queue work?,COS121,A queue is FIFO list. That means that the first thing to go in the array is the first that comes out. Its like a line. When people stand on the line for something&#44; the first person on the line is the first person to get served. You join the line at the back and leave at the front.
1270,,,8.75,Create a finite state machine that computes the parity of the input.,COS381,
1426,SRW,X,8.71,Compare and contrast the roles of crossover versus mutation in genetic algorithms.,SYS411,Crossover makes changes to individuals within a population by mixing them in some way with other individuals&#44; while mutation changes an individual randomly&#44; causing variation within the population.
1425,,,8.71,Describe the operation of a typical rule-based expert system from initiation through termination.,SYS352,
1630,,,8.67,What is the role of a system analyst?,N/A,
1192,,,8.67,How can a project manager ensure team meetings are productive?,COS340,
1684,,,8.67,How do you perform usability testing?,N/A,
1689,NJC,X,8.67,"COS 314: What are the ideas in the web philosophy of ""Don't make me think""?",SYS214,This basically means that if you design a website that is easy and quick to use and navigate through then the user doesn't mind looking through your site. But if the site is hard to navigate through then the user will probably leave the site and will not be interested even if you site is really important.
1690,,,8.67,How does copyright affection your profession on a day-to-day basis?,N/A,
1701,,,8.67,divide and conquer algorithm?,N/A,
1703,,,8.67,Describe the basic process for transmitting secure data using a public-key cryptosystem.,N/A,
1714,SRW,X,8.67,What is meant by event driven programming?,N/A,Using event listeners and event handlers to drive the logical flow. This means that the program waits for some kind of outside input and responds to it&#44; as opposed to just running through a sequence of commands.
1723,AK,X,8.67,What is a deontological ethical framework?,COS 311,"Deontological ethics or deontology (from Greek deon&#44; ""obligation&#44; duty""; and -logia) is the normative ethical position that judges the morality of an action based on the action's adherence to a rule or rules. It is sometimes described as ""duty"" or ""obligation"" or ""rule"" -based ethics&#44; because rules ""bind you to your duty""."
926,,,8.67,Discuss multiplexing and list some approaches.,N/A,
928,,,8.67,What is exponential complexity? Give an example.,N/A,
932,,,8.67,What are some potential problems with dynamic memory management?,N/A,
90,BN,X,8.67,Contrast forward chaining and backward chaining in an inferencing environment.[follow on] Which does CLIPS use most naturally?,SYS352,Backwards chaining starts with a goal and tries to prove it using the set of initial facts.  Forward-chaining starts with the initial facts and starts establishing everything that can be established from those facts.  CLIPS more naturally supports forward chaining
171,,,8.67,Distinguish two-tier client-server architectures from three-tier and given advantagesof each.,SYS394,
270,,,8.67,When considering a tree data structure&#44; what is the meaning of depth of a node?[follow on] Height of the tree? [follow on] Degree of a node?,COS250,
1024,,,8.67,What functionality is provided by a B2B site?,N/A,
714,,,8.67,How does a hash function work? [follow on] Why go to the trouble of hashing?,COS250,
609,,,8.67,Convert the following octal number to binary and decimal: 473,COS381,
153,,,8.67,Contrast the following types of keys: candidate&#44; primary&#44; alternate&#44; foreign&#44; concatenated,SYS390,
1055,,,8.67,How do you characterize a greedy algorithm? Give an example.,N/A,
1079,,,8.67,Could a hash table be used to avoid sorting?,N/A,
1103,,,8.67,What are some typical uses of javascript? Where does it execute?,N/A,
1108,,,8.67,compare and contrast stored procedures vs. host language queries.,,
1189,,,8.67,What is a communication protocol? Conceptually&#44; what two aspects of communication does a protocol specify?,COS331,
1213,,,8.67,What is the difference between static and dynamic linkers? What problems with static linkers were dynamic linkers trying to solve?,COS284,
1242,,,8.67,What is the difference between continuous and discrete simulation?,N/A,
1247,,,8.67,How do noise reduction filters work?,N/A,
1350,,,8.67,What are white hat and black hat hackers?,N/A,
1379,,,8.67,What is the difference between vector graphics and raster graphics?,N/A,
1396,,,8.67,What does the box model look like for the sample page on the board?,N/A,
1470,,,8.67,What is Big-Oh notation? Give a couple of examples of algorithms and their associated Big-Oh formula.,N/A,
1496,,,8.67,What does AJAX stand for&#44; and how does AJAX work?,N/A,
1354,,,8.67,How would you start learning about a new CS topic (e.g.&#44; image searching algorithms)?,COS310,
1560,,,8.67,List some of the major machine learning paradigms or methods.,SYS411,
1438,,,8.67,Create a 2:1 multiplexor.,COS381,
1581,,,8.67,What is source code versioning? What sorts of tools would you use to accomplish this?,N/A,
1191,,,8.67,What factors are suggestive of a project risk that must be actively managed?,COS340,
1604,,,8.67,What was the most important paper you read in software studio? Why?,N/A,
1609,,,8.67,Why are ORMs attractive?,N/A,
1335,,,8.67,Explain the importance of knowing the business to successful systems analysis,SYS390,
1152,,,8.65,Create a binary search tree by inserting the following items in the order given:,COS121,
,,,,8 2 4 3 7 5 9 1 6,,
1227,,,8.65,What are some differences between client-based languages and server-based languages?,COS264,
1147,,,8.64,What does a systems analyst do?,SYS392,
1119,,,8.63,Why is it important to maintain balance in trees? Name and briefly describe one approach.,COS265,
719,,,8.6,How would you analyze the performance of a recursive function?,COS320,
440,,,8.6,A number of ways to control access to a data communications medium have been conceived&#44;including ALOHA&#44; slotted ALOHA&#44; CSMA and CSMA/CD. Pick one and describe how it works.,COS331,
488,,,8.6,What is the Hawthorne effect? (Peopleware),COS340,
154,,,8.6,What is cardinality and what does it show?[follow on] What does a cross tick with crows feet mean?,SYS390,
1331,SRW,X,8.58,How does a C compiler use a jump table to implement a switch() statement?,COS284,Each case gets a different memory address. A jump table lists all of these addresses and the index is used to move control flow into the correct position in the table.
1626,,,8.5,What is the difference between polygonal modeling and NURBS modeling? Advantages?,N/A,
1513,,,8.5,What is the role of a type system for a programming language?,COS382,
1671,,,8.5,How do you calculate a surface normal for a patch surface (Bezier&#44; etc)?,N/A,
1182,,,8.5,Describe a method for measuring the performance of a portion of an application.,COS284,
1146,,,8.5,What does a systems analyst do?,SYS392,
1751,,,8.5,What is a RISC processor? What are the characteristics of a RISC architecture?,N/A,
530,,,8.5,How would you explain to a friend what rendering is?,COS350,
406,,,8.5,What is a minimum spanning tree applied to a weighted graph? [follow on] What is ituseful for?,COS320,
828,,,8.5,2-tier vs. 3-tier,N/A,
527,,,8.5,When calculating the light intensity of a point on a surface it is sometimes criticalto know something about a surface normal. What is that?,COS350,
5,,,8.5,What are some barriers to communication within an organization?,IAS330,
833,NJC,X,8.5,why is feedback important?,COS314,Feedback is important because this is the way that you can find out what things you did well and what things you need to work on and things that you missed or should add. Basically it is so that you find out if the project you are working on is what people will like or not.
462,,,8.5,Compare three types of team organization used in software development.,COS340,
689,,,8.5,Earlier this morning - student stated complexity as O(200 m^2 n^2) - why did this make the algorithms instructor unhappy?,COS320,
221,,,8.5,If you were involved in performing sensitivity analysis while running a simulation&#44;what would you be doing and why?,SYS402,
199,,,8.5,Is there any advantage to using a simulation language over using a general purposelanguage?,SYS402,
860,,,8.5,What is a balanced tree? Why is it important?,N/A,
875,AK,X,8.5,How does AJAX work?,N/A,http://en.wikipedia.org/wiki/Ajax_(programming)
451,,,8.5,What are two types of noise encountered in data communications? [follow on] What arecommon causes of each?,COS331,
82,,,8.5,What are some ways of controlling the order in which rules fire in a CLIPS program?,SYS352,
118,,,8.5,What does an Event-Response table contain? [follow on] Why use one?,SYS390,
1016,,,8.5,What is the difference between discrete and continuous simulations?,N/A,
1039,,,8.5,Describe the differences between traditional engineering design and concurrent engineering.,N/A,
627,SRW,X,8.5,What are some reasons for learning and writing in assembly language?,COS381,Reverse engineering compiled code. Squeezing every bit of optimization out of a program. Understanding what is going on under the hood.
283,,,8.5,What is an adjacency list/matrix?,COS250,
969,,,8.5,What is an optimization that an application programmer may apply to their code to execute efficiently on an architecture with a memory hierarchy? You may use a matrix-matrix multiply as an example if one does not come to mind.,COS284,
1075,SRW,X,8.5,What types of problems are well suited for neural networks?,N/A,Optimization and classification problems that are quantifiable and have no good brute force solution.
1096,,,8.5,What are the basic concepts of key frame animation?,N/A,
1205,,,8.5,What is normalization?,N/A,
1187,,,8.5,What are preconditions and postconditions?,COS320,
1297,,,8.5,draw a RS-232 waveform and describe how the signal is received (especially for a noisy signal),N/A,
1295,,,8.5,Describe how this transistor works.,ENP352,
1298,,,8.5,interpret circuit on board,N/A,
1346,,,8.5,What is compositing? How is it useful in animation production?,COS425,
1432,,,8.5,greedy algorithm - describe,N/A,
1445,,,8.5,OO languages: smalltalk&#44; C &#44; Java,N/A,
1456,,,8.5,When would Flash be an appropriate language to develop a web site with?,N/A,
1469,,,8.5,What is inverse kinematics? Why is it useful in animation?,N/A,
1509,,,8.5,Discuss the basic idea of curve fitting - if you place points in a window&#44; how do you create a smooth curve through the points.,N/A,
1538,,,8.5,Describe twos complement numbers.,N/A,
1542,,,8.5,What makes a crystal structure electrically conductive or insulative? For example why is copper conductive and silicon not so conductive?,N/A,
1543,,,8.5,How does pipelining work?,N/A,
1591,,,8.5,what is hypothesis testing?,N/A,
1592,,,8.5,sequential file processing...what to do?,N/A,
1603,,,8.5,What is KT decision analysis?,N/A,
,,,,Give an example of when it would be used.,,
1144,,,8.48,What are Crosbyâ€™s four absolutes of quality management? How does each relate to quality management of information systems?,SYS390,
1308,,,8.43,What steps does a designer need to follow to ensure they make an interface that the user will like using?,COS314,
1159,,,8.42,Which is more important&#44; the user interface or the functionality of a program or web page.,COS314,
1123,,,8.42,"What makes up a ""good"" research proposal?",COS310,
258,,,8.4,What is a linked list? [follow on] What are some extensions of a simple linked list?,COS250,
73,,,8.4,What are some of the components of a rule-based language or expert system?,SYS352,
1266,,,8.35,"What is meant by ""collision"" in a hash array? How are they handled?",COS265,
1114,,,8.33,There are at least a few categories of SQL queries. What are these and how do they differ from one another?,COS240,
1667,,,8.33,What kinds of security should an e-commerce site consider?,N/A,
1687,,,8.33,How does AJAX work?,N/A,
881,,,8.33,Discuss hash and heap data structures.,N/A,
140,,,8.33,What are a couple of ways that database integrity can be maintained?,SYS390,
234,,,8.33,In Visual Basic&#44; what are Properties? Give a few examples.[follow on] How can they be set and changed?,COS240,
298,,,8.33,"How does a hash function work? [follow on] Why go to the trouble of hashing?ANWSER:An input value is run through a hash function which returns an index into a hash table.The input value is stored or looked for at the indexed position in the hash table.If storing and something already exists at that location&#44; a ""collision"" occurs andmust be resolved.If searching and the input is not found&#44; additional search must be performed.Why - compresses storage required and minimizes search timeQUESTION:What is the difference between permutations and combinations?",COS252,
243,,,8.33,What are three distinctive characteristics of object oriented programming?,COS250,
260,,,8.33,What is a major advantage of linked lists?,COS250,
294,,,8.33,How does one convert between number systems? Illustrate by converting decimal 13 tobinary.,COS252,
987,SRW,X,8.33,Is AI AI?,COS284,Sometimes
1011,,,8.33,For your project&#44; what did the SRT contain/look like?,N/A,
482,,,8.33,What inevitably follows overtime? (Peopleware),COS340,
309,,,8.33,What is Dijkstra's algorithm used for? [follow on] How does it work?,COS252,
631,,,8.33,What is microprogramming?,COS381,
389,,,8.33,Sometimes one wishes to search a tree structure. What are two standard approachesto doing that? Draw a tree on the board and illustrate the two search algorithms.,COS320,
1224,,,8.33,what is a hash table? why are they used?,N/A,
1248,,,8.33,What is Business Process Reengineering (BPE)?,N/A,
1327,,,8.33,Show that the sequence 1&#44; -1!&#44; 2! -3!&#44; 4!&#44; . . . &#44; (-1)n n!&#44; . . . for n >= 0&#44; satisfies the recurrence relation ,MAT215,
,,,,,,
,,,,sk = (-k ) sk-1,,
1362,,,8.33,What is a page table?,N/A,
1384,,,8.33,How should a developer decide between HTML or Flash web pages?,N/A,
1471,,,8.33,What is a security audit? How is one performed?,N/A,
1472,,,8.33,What is your favorite programming language? Why?,N/A,
1475,,,8.33,Explain how when you type in www.google.com&#44; packets from your system actually get to the correct server?,N/A,
1477,,,8.33,How does a machine determine its IP address when it boots?,N/A,
1484,,,8.33,What is a pointer? How does a pointer translate to machine instructions?,N/A,
1615,,,8.33,What is an ADT?,N/A,
1226,,,8.31,How can a PHP page access the information sent to the server by the client?,COS264,
1158,,,8.29,Why does Donal Norman value the following principles so highly: affordances&#44; visibility&#44; feedback&#44; and memory load?,COS314,
337,,,8.29,What are Java exceptions and how do we handle them?,COS264,
463,,,8.25,What are the objectives in creating and using project metrics?,COS340,
